reviews.text,processed_text,reviews.rating
Out of all the lip protectors this is the only one that works.....and I have tried a lot of different chap sticks...trying to save money or wanting to get a good flavor or just the right color...doesn't matter...Carmex is the only one that works...thank you for making it!!,lip protector one worksand tried lot different chap stickstrying save money wanting get good flavor right colordoesnt mattercarmex one worksthank making,5.0
"My sister has used Carmex in a jar for years. She would even put it on her eyelids at night. LOL Not quite sure why, but never had sagging skin there! I loved the fragrance started using it myself way back when. I will never use anything else. It really conditions my lips.",sister used carmex jar year would even put eyelid night lol quite sure never sagging skin loved fragrance started using way back never use anything else really condition lip,5.0
"I've used Carmex for years and am very happy with the product. I'm just curious, did the formula change It seems to smell different (maybe my sniffer has changed!). Please keep up the good product.",ive used carmex year very happy product im curious formula change seems smell different maybe sniffer changed please keep good product,5.0
For as long as I can remember I've been using Carmex on my lips! This one in the jar is my favorite. The smallest bit goes the longest way and you'll probably lose it before you run out! I love applying it before lipstick so my lips stay nice and moisturizer all day long!,long remember ive using carmex lip one jar favorite smallest bit go longest way youll probably lose run love applying lipstick lip stay nice moisturizer day long,5.0
"Been using this stuff as far back as I remember. Don't go anywhere with it. Tried several other products but not as good. Started with the jar, then the tub, and now the stick. Highly recommended! Don't even bother trying anything else, when you have the best, why bother",using stuff far back remember dont go anywhere tried several product good started jar tub stick highly recommended dont even bother trying anything else best bother,5.0
"A month ago my lips along with the rest of me got very sunburned and I tried the blistex I had and it wasn't helping at all. I was in the gas station and picked some carmex up and wow instant long lasting relief. Thought to myself, wish I could spread this all over my body.",month ago lip along rest got very sunburned tried blistex wasnt helping gas station picked carmex wow instant long lasting relief thought wish could spread body,5.0
"I really like Carmex in general, I started with using the jar when I had chapped lips and I was sold the first time, by the end of the day I could feel my lips healing up. Now I have long nails so I have graduated to the lipstick looking Carmex and I love that one as well.",really like carmex general started using jar chapped lip sold first time end day could feel lip healing long nail graduated lipstick looking carmex love one well,5.0
I have been using this for years...literally. I am 61 and have used this since the 60s,using yearsliterally used since,5.0
"I love Carmex. Love the small container that it comes in. It really works for me a lot. Especially in winter time. My face gets really dried out . I use a little bit on the dry parts of my face , it works great. Thanks for such a great product. I buy nothing but Carmex.",love carmex love small container come really work lot especially winter time face get really dried use little bit dry part face work great thanks great product buy nothing carmex,5.0
It works so great on my cold sores! The moment I saw one coming up and I instantly put it on and the irritation stops. Then I swear it sped up the blistering and leaking time as well and now it's scanning over and healing right now. Love it!,work great cold sore moment saw one coming instantly put irritation stop swear sped blistering leaking time well scanning healing right love,5.0
"I buy this all the time and I have at least 4 open at one time in my purse, by my computer desk, right on my night stand and of course one riding my car! I have dry lips all the time and Carmex is my best friend it keeps my lips soft and moist and kissable for my husband.",buy time least open one time purse computer desk right night stand course one riding car dry lip time carmex best friend keep lip soft moist kissable husband,5.0
"Coming into Spring my lips were so dry that I couldn't even open them right up. Lipstick looked bad on me and was embarrassing. I tried Nivea, manuka honey lip balm and more! A week ago I heard the ad on the radio about Carmex, so I stopped to buy it. Best decision ever!",coming spring lip dry couldnt even open right lipstick looked bad embarrassing tried nivea manuka honey lip balm week ago heard ad radio carmex stopped buy best decision ever,5.0
The others seem only to provide a barrier over the lips whereas Carmex actually moisturizes and heals them. I love this stuff. I've used it exclusively for as long as I can remember. Let everyone else try what they will ... I'll have only Carmex!,others seem provide barrier lip whereas carmex actually moisturizes heals love stuff ive used exclusively long remember let everyone else try ill carmex,5.0
I have used Carmex Lip Balm Jar ever since I was a little kid and though people make fun of me because I'm old school I don't care...I LOVE IT!!! It gets the job done and keeps my lips smooth and protected. I appreciate it and so does my wife! :) Thanks Carmex!,used carmex lip balm jar ever since little kid though people make fun im old school dont carei love get job done keep lip smooth protected appreciate wife thanks carmex,5.0
"I have used CARMEX for years, it is the only lip moisturizer/therapy that works for my lips. I have tried many others including all the name brand type but CARMEX is the only one that works every time. I use it winter and summer.",used carmex year lip moisturizertherapy work lip tried many others including name brand type carmex one work every time use winter summer,5.0
"I bought this one day hoping it would help. That was 5 years ago and I have used it every night since. We keep 1 on my husbands night table and on mine. My lips are slathered when I go to bed and when I wake up, they are baby soft. Love my full pout with this product.",bought one day hoping would help year ago used every night since keep husband night table mine lip slathered go bed wake baby soft love full pout product,5.0
I'v been using carmex for as long as I can remember I'm 57 now I tried others but always go back I like the jar because you can use what you need and it's like an old friend when lips are dry the old yellow and white jar is just the ticket :) BTW I miss the glass jar :(,iv using carmex long remember im tried others always go back like jar use need like old friend lip dry old yellow white jar ticket btw miss glass jar,5.0
"You can always rely on a jar of Carmex to relieve your chapped lips all year round! I especially use it throughout the winter and keep one in my pocket (and the nightstand, and the kitchen, and the desk...). I've even used it on my nose when I have a cold to protect it!",always rely jar carmex relieve chapped lip year round especially use throughout winter keep one pocket nightstand kitchen desk ive even used nose cold protect,5.0
"Been using lip balm for many years. Tried just about every brand. Carmex has been the best for my lips. I stopped trying brands after Carmex. And when the can was introduced, WOW!, takes away any disadvantage of tubes/rollers always keeping my lip protection protected.",using lip balm many year tried every brand carmex best lip stopped trying brand carmex introduced wow take away disadvantage tubesrollers always keeping lip protection protected,5.0
"Last year I was having a lot of trouble with very dry chapped lips, tried chapped stick, which normally helps. But this time it was not, so I purchased Carmex in the jar and started using it and immediately started to see relief. I keep it handy in my bathroom.",last year lot trouble very dry chapped lip tried chapped stick normally help time purchased carmex jar started using immediately started see relief keep handy bathroom,5.0
I have been an avid Carmex original lip balm jar user for years now. I don't think I could ever use anything else. I love the way it moisturizes my lips without feeling waxy or gunky. The price-point is completely reasonable as well.,avid carmex original lip balm jar user year dont think could ever use anything else love way moisturizes lip without feeling waxy gunky pricepoint completely reasonable well,5.0
I have bought many products for chapped lips. I bought Carmex one day years ago and loved it. Carmex is the best. I don't buy anything else now. It is also good for coldsores. I love the cool feeling on my lips. Carmex rocks!!!,bought many product chapped lip bought carmex one day year ago loved carmex best dont buy anything else also good coldsores love cool feeling lip carmex rock,5.0
Back when I was little and complained about my super dry and chapped lips I remember my dad handing me a little jar of lip stuff Now I have all forms of CarMex but this one holds memories as I apply it to fix my aweful lips.,back little complained super dry chapped lip remember dad handing little jar lip stuff form carmex one hold memory apply fix aweful lip,5.0
Worse case of chapped lips ever! Desperate we stopped at a drug store and sked for the best and fastest cure. Was advised to use Carmex. It started working right away and in a few days the lip licking and soreness had disappeared.,worse case chapped lip ever desperate stopped drug store sked best fastest cure advised use carmex started working right away day lip licking soreness disappeared,5.0
"My mother used this product, and now I use it and so does my grown daughter. It has worked well to heal cracked dry lips and I've tried lots of products over the years but always come back to Carmex. Now, I won't use anything else.",mother used product use grown daughter worked well heal cracked dry lip ive tried lot product year always come back carmex wont use anything else,5.0
"Carmex is my go to product most of the time when my lips are dry. I love the original jar just because thats what I grew up with I think, but I really love all carmex products! I love the smell, feel and how it helps my chapped lips!",carmex go product time lip dry love original jar thats grew think really love carmex product love smell feel help chapped lip,5.0
"Living in the desert, it is a struggle to keep my lips from drying out and cracking. When daily summer temps are over 100 degrees daily, protecting my lips is important. The ONLY thing that works is carmex! I prefer the original jar.",living desert struggle keep lip drying cracking daily summer temp degree daily protecting lip important thing work carmex prefer original jar,5.0
I used to use eos and I found out that I was allergic to it so I stuck with Carmex. Carmex is the best lip balm in the world!!!,used use eos found allergic stuck carmex carmex best lip balm world,5.0
"Our family loves Carmex! You will find Carmex In every room of our house, our cars. we are Boyscout leaders and We all have Carmex in our backpacks. Our kids all get Carmex in there stockings for Christmas. Can't live without it!!",family love carmex find carmex every room house car boyscout leader carmex backpack kid get carmex stocking christmas cant live without,5.0
"Carmex jarred lip balm reminds me of being a little girl and going to the water park with my family. My mom would put it on my lips to prevent them from being sunburned. She always carried it in her purse....and now, so do I. :)",carmex jarred lip balm reminds little girl going water park family mom would put lip prevent sunburned always carried purseand,5.0
I buy this every year. Its a must have for the winter months. Not only is it great for your lips but its also great for the rough egdes of your nose when its chapped. Always has been the greatest product. And it also smells good.,buy every year must winter month great lip also great rough egdes nose chapped always greatest product also smell good,5.0
I have been using Camex in the jar for the last 4 yrs. I used it once in the morning also again before I go to sleep. I enjoy the way it feels and protects my lips. My wife says I crazy for as many times I apply the wax to my lips.,using camex jar last yr used morning also go sleep enjoy way feel protects lip wife say crazy many time apply wax lip,5.0
"I have been a fan of Carmex for years! I wish I could remember when I first used Carmex for my cold sore, but I'm sure it was 20 years ago and I never leave home without one in my purse. Love, Love, Love this product..Thanks!!!!",fan carmex year wish could remember first used carmex cold sore im sure year ago never leave home without one purse love love love productthanks,5.0
"This is the only lip balm I purchase. My lips get dry easily and I get a cold sore a couple times a year. Once I feel a cold sore coming on, I apply this and can feel it start to work immediately. I would recommend this to anyone!",lip balm purchase lip get dry easily get cold sore couple time year feel cold sore coming apply feel start work immediately would recommend anyone,5.0
I have been using Carmex since I was a little girl because of my Mom. Carmex is her absolute favorite lip balm and I don't blame her! She has also been using Carmex forever. I have never had a lip balm work as well as Carmex.,using carmex since little girl mom carmex absolute favorite lip balm dont blame also using carmex forever never lip balm work well carmex,5.0
carmex is the only thing that saves my precious lips in the blustery windy cold of western ny. (remember buffalo last year). I have used this since i was a kid and i cant imagine ever changing because this works the best.,carmex thing save precious lip blustery windy cold western ny remember buffalo last year used since kid cant imagine ever changing work best,5.0
I have been buying these little pots for years not only to heal my lips but to protect them.This product keeps my lips soft and full and free from painful cracks during the winter.As a pharmacist I also recommend this product.,buying little pot year heal lip protect themthis product keep lip soft full free painful crack wintera pharmacist also recommend product,5.0
"This is the product I remember using the very most it seems as a child it was just always around us all the time, for cracked Winter skin, then when the heat came out and cracked even more just great to have handy always.",product remember using very seems child always around u time cracked winter skin heat came cracked even great handy always,5.0
"The minute my lips can't take anymore of the harsh conditions of the Florida sun I reach for the cooling and soothing relief of my old stand-b, Carmex Lip Balm in the jar. I apply it at night and by morning my lips are healed. This is a go to product you will rely on again and again!!",minute lip cant take anymore harsh condition florida sun reach cooling soothing relief old standb carmex lip balm jar apply night morning lip healed go product rely,5.0
"I have used this product for over 10 years. It is part of my makeup routine before applying lipstick in the morning, and used throughout the day. I don't know what I would do without Carmex during the winter season living in the Midwest. It keeps my lips moisturized and looking great!",used product year part makeup routine applying lipstick morning used throughout day dont know would without carmex winter season living midwest keep lip moisturized looking great,5.0
I always keep carmex on hand. It is always nice to have during harsh summer sun or cold IA winters. Gives your lips healing security. Toss it in your purse or keep it in your pocket always there to heal. Nothing compares for those dreaded cold sores that peak during the flu season.,always keep carmex hand always nice harsh summer sun cold ia winter give lip healing security toss purse keep pocket always heal nothing compare dreaded cold sore peak flu season,5.0
There are harsh cold winters and dry summers in Chicago which can really affect my lips. Moisture and protection is what I wanted and so I bought this product for those reasons. Not only did it deliver but it also healed my chapped lips. Only negative is that I have to use my finger.,harsh cold winter dry summer chicago really affect lip moisture protection wanted bought product reason deliver also healed chapped lip negative use finger,4.0
Nearly 40. Been using this for years on lips and cuticles. I wish the packaging didn't change. The inverted bottom isn't right. Wish there was a vegan version was available. How is the lanolin derived for this product My favorite before all the changes.,nearly using year lip cuticle wish packaging didnt change inverted bottom isnt right wish vegan version available lanolin derived product favorite change,3.0
I have been using carmex for decades and will not use anything else. We lived in Maryland in the late 80 s and I could not find it there. When I came home to Kansas I bought enough to last and some for other people from Kansas that were there too. I highly recommend it to anyone.,using carmex decade use anything else lived maryland late could find came home kansa bought enough last people kansa highly recommend anyone,5.0
"ive been using this for 4 years and so far its been a product i use every single day, its my go to product. honestly its so amazing, after scrubbing ur lips put this on and ur lips feel amazing and smooth. and results are great in the morning when applying this before sleeping.",ive using year far product use every single day go product honestly amazing scrubbing ur lip put ur lip feel amazing smooth result great morning applying sleeping,5.0
"I have been using this product for about 8 years. I started because I was getting very chapped lips and nothing was helping. I use it in the morning and at night everyday. Have not had chapped lips, or cold sores in 8 years. I recommend to anyone who has problems with their lips.",using product year started getting very chapped lip nothing helping use morning night everyday chapped lip cold sore year recommend anyone problem lip,5.0
I have been buying the Carmex jar as long as I can remember. The reason I have bought it for so many years is I was in the military and would throw it in my bag work bag. I never had the jar crushed or come open even when the bag was tossed around and all my gear would hit it.,buying carmex jar long remember reason bought many year military would throw bag work bag never jar crushed come open even bag tossed around gear would hit,5.0
"We us both use the original jar and tube. My son use it all the time. I buy it in bulk. Mu son use it a lot, he is outside with sports. So we have to keep a lot of it. We don't see much of the other flavors, just strawberry or cherry, we stick to the originals jars and tubes.",u use original jar tube son use time buy bulk mu son use lot outside sport keep lot dont see much flavor strawberry cherry stick original jar tube,5.0
I buy this type of Carmex all the time! It is my favorite one out of all the choices. I am always using it when the corners of my mouth crack. It is the ONLY product that I have used that heals them. I absolutely recommend this product for anyone who has any type of lip issue.,buy type carmex time favorite one choice always using corner mouth crack product used heals absolutely recommend product anyone type lip issue,5.0
"I have used Carmex for over 26 years! I don't go anywhere without a tub or stick. It keeps my lips soft and moist, and protected in the cold winter months, especially while skiing and snowshoeing. The only thing I'd ever change is I'd bring back the mint flavor. It was the best!",used carmex year dont go anywhere without tub stick keep lip soft moist protected cold winter month especially skiing snowshoeing thing id ever change id bring back mint flavor best,5.0
In middle school when my lips started to burn like crazy... Had to go the doctor... They said I had wind burn n told me to go get some Carmex... Really but it did the trick.. 26 yrs old n it help me from get rid of my wind burns on my lips each time I get them... Thank u,middle school lip started burn like crazy go doctor said wind burn n told go get carmex really trick yr old n help get rid wind burn lip time get thank u,5.0
"I have used Carmex for as long as i can remember. The fragrance is what drew me in. I thought well, at least my lips will smell good But i was pleasantly surprised at how moist and smooth it kept my lips. I have a jar of Carmex at my desk, one in my purse and I never run out.",used carmex long remember fragrance drew thought well least lip smell good pleasantly surprised moist smooth kept lip jar carmex desk one purse never run,5.0
Having a daughter with excema is hard so when ever she suffers from sever dry lips and cold soars i always can count on Carmex to deliver. Works amazing and helps heal dry chaps lips. Love how its helps the itchy feeling and protects her lips from sun exposure and cracking.,daughter excema hard ever suffers sever dry lip cold soar always count carmex deliver work amazing help heal dry chap lip love help itchy feeling protects lip sun exposure cracking,5.0
I have been a big fan of the Carmex jar since I was a little girl in elementary school. This would be the only product I would let my parents buy me. Living in northern Minnesota a person really needed this. I love the little yellow jar and the smell too. Best product ever!,big fan carmex jar since little girl elementary school would product would let parent buy living northern minnesota person really needed love little yellow jar smell best product ever,5.0
"I love this product! It's the original and the one that I first used b/c my dad always used it and swore by it. I love how quickly it works and that is works so great, really keeping my lips from getting chapped and cracked and once they are, it works quickly to heal them.",love product original one first used bc dad always used swore love quickly work work great really keeping lip getting chapped cracked work quickly heal,5.0
"I have been buying this version of car next lip care since I was 12. I am now 26 years old, it is a regularly used part of my beauty regime. Keeps your lips soft smooth for hours. Using this product regularly also keeps those dry, irritated winter lips away. It's amazing!",buying version car next lip care since year old regularly used part beauty regime keep lip soft smooth hour using product regularly also keep dry irritated winter lip away amazing,5.0
"I bought this size container for my dad very often. He always had sore corners of his mouth, and he loved the round container. He wanted to always be ready for kisses (from me and his nurses), and it always healed the corners of his mouth w/o a bad taste. He used it daily.",bought size container dad very often always sore corner mouth loved round container wanted always ready kiss nurse always healed corner mouth wo bad taste used daily,5.0
I love this stuff I was addicted to bliss stick but for the last 5 years I ran across this at the store it was so smooth and not greasy on my lips and I have bought it faithfully every year I don't really care for the cherry but I will use it even my grandkids call it by name they have to have their own personal one also we love it,love stuff addicted bliss stick last year ran across store smooth greasy lip bought faithfully every year dont really care cherry use even grandkids call name personal one also love,5.0
"The big thing in high school was to always have car ex in the jar. I graduated in 1987 and have been using ever since. I may not be able to find my keys, money, etc. in my purse, but I can always find my Carmex! Leaves my lips feeling soft and smooth and cures dry chapped lips in no time. I can't live without it! Love this product!",big thing high school always car ex jar graduated using ever since may able find key money etc purse always find carmex leaf lip feeling soft smooth cure dry chapped lip time cant live without love product,5.0
I bought this 3 days a ago and I'm a first time user of this brand and not sure if I use again as my lips are on fire every time I apply is this a normal reaction Or am I just using the wrongs thing because thousands of people across the world rave about how amazing it is feedback would be great to hear,bought day ago im first time user brand sure use lip fire every time apply normal reaction using wrong thing thousand people across world rave amazing feedback would great hear,1.0
"I had tried a new lip butter. But went back to Carmex Original Lip Balm Jar because it lasts longer, and is less expensive. I used to apply lip balm sticks during the day, and Carmex Jar at night, but the lip balm sticks don't last. So now I use the jar all day, too. I even bought a package of 12 jars because it saves me money!",tried new lip butter went back carmex original lip balm jar last longer le expensive used apply lip balm stick day carmex jar night lip balm stick dont last use jar day even bought package jar save money,5.0
"I grew up with this in my house. My mom always had some that she used all the time in the winter also whenever she got a cold sore. I never had any colds sores, so I do not know if it really helps with that, but I do know that it is great for those dry,cracked windburned lips that those of us living up North get every winter.",grew house mom always used time winter also whenever got cold sore never cold sore know really help know great drycracked windburned lip u living north get every winter,4.0
