reviews.text,processed_text,reviews.rating
Never gets cold enough.,never get cold enough,0.0
"We received the unit a few days ago. So far it is as promised. Noise level outside the unit is acceptable--slightly less than your average refrigerator, around 40db in the surrounding area. Fine for a common area of the home. It cooled our wine down from 77 to 55 degrees pretty quickly. We have tried out a couple of thermo-electric units that seems to run for hours upon hours, never quite reaching the desired temperature--so we decided to go with a compressor based refrigerator that has more power and therefore, won't have to run as many hours (and require service/repair as quickly). The cooler looks great as shown. The refrigerant is R600--it is nontoxic--which is a big plus. When it is running, the top of the unit gets hot--so don't put any candles on it! We removed the second-to-last shelf (towards the bottom) to comfortably accommodate our different-sized bottles. We currently have 30 bottles in there, and could fit comfortably 5-7 more (Syrah, Grenache and Burgundy bottles take up more space than standard Bordeaux-type bottles). It is hard to find a good quality, long-lasting wine refrigerator--after much research--hopefully we have found the best one. Time will tell. Finally, I would give five stars for this cooler, however the seller was extremely slow to respond to my product inquiries and is unclear as to the terms of warranty (other companies have stated one year for cooler plus 3 years for compressor, for instance). Hopefully we won't have any problems in the future, in which case I suppose we would have to lean on Amazon to remedy the situation.",received unit day ago far promised noise level outside unit acceptableslightly le average refrigerator around db surrounding area fine common area home cooled wine degree pretty quickly tried couple thermoelectric unit seems run hour upon hour never quite reaching desired temperatureso decided go compressor based refrigerator power therefore wont run many hour require servicerepair quickly cooler look great shown refrigerant rit nontoxicwhich big plus running top unit get hotso dont put candle removed secondtolast shelf towards bottom comfortably accommodate differentsized bottle currently bottle could fit comfortably syrah grenache burgundy bottle take space standard bordeauxtype bottle hard find good quality longlasting wine refrigeratorafter much researchhopefully found best one time tell finally would give five star cooler however seller extremely slow respond product inquiry unclear term warranty company stated one year cooler plus year compressor instance hopefully wont problem future case suppose would lean amazon remedy situation,0.0
"Excellent Wine Cellar, doesn't take up much space. It's quiet when running and seems to maintain the temperature you set it. This is only the case if you don't have a power outage in your area. It will default to 66 degrees when the power returns.",excellent wine cellar doesnt take much space quiet running seems maintain temperature set case dont power outage area default degree power return,0.0
They claim that it holds 52 bottles. i could barely squeeze in about 47 and these were at a tightness to where i was concerned that i would break the wood drawers.,claim hold bottle could barely squeeze tightness concerned would break wood drawer,0.0
"Didn't get 5 stars because it doesn't spare any room for bottles that are a little longer. They should redesign for a little extra room, otherwise it seems to be working pretty well.",didnt get star doesnt spare room bottle little longer redesign little extra room otherwise seems working pretty well,0.0
"We received this two days ago in perfect condition. so far I am very satisfied. The unit looks great, operates fairly quietly, and is maintaining a perfect 55 degrees for our good reds. i only have 55 bottles in it so I have not tested the full capacity. the only con so far is that we have a few fatter than normal bottles that did not fit on certain shelves and some taller bottles that did not fit on the bottom shelves because of the compressor behind. But these are minor annoyances.",received two day ago perfect condition far very satisfied unit look great operates fairly quietly maintaining perfect degree good red bottle tested full capacity con far fatter normal bottle fit certain shelf taller bottle fit bottom shelf compressor behind minor annoyance,0.0
Slightly noisier than I'd prefer but quiet enough to have just outside a bedroom. Bottles fit nicely. The unit doesn't take up too much space but holds good amount. Overall pleased after 2 months of use.,slightly noisier id prefer quiet enough outside bedroom bottle fit nicely unit doesnt take much space hold good amount overall pleased month use,0.0
Helps internal operations.,help internal operation,5.0
Great way to get extra fiber!,great way get extra fiber,5.0
For us this is a good product at a reasonable price. we have used it for many years. Ordering online was fast and easy and having it shipped right to our doorstep was great. It was on time and we experienced no problems.. Just the way we like it.,u good product reasonable price used many year ordering online fast easy shipped right doorstep great time experienced problem way like,5.0
Chewing a tablet daily is a very easy way to get fiber in your diet and control the amount of water that you are drinking and when you drink it.,chewing tablet daily very easy way get fiber diet control amount water drinking drink,5.0
easy to chew the taste is pretty good too,easy chew taste pretty good,5.0
"I have been using Fiber Choice tabs for several years and feel they help keep bowel movements normal. They are a little pricey at 11cents per tablet, but are much easier to take than mixing powders with water - so convenience is worth something.",using fiber choice tab several year feel help keep bowel movement normal little pricey cent per tablet much easier take mixing powder water convenience worth something,4.0
"I'm the computer person, but the good wife says that these cured her constipation 10 years ago and won't be without them",im computer person good wife say cured constipation year ago wont without,5.0
Works pretty well the only downside to it is it makes you extremely gassy which can be embarrassing at times.,work pretty well downside make extremely gassy embarrassing time,4.0
Have used this for a few years. So happy I can get them delivered to my home now. I feel these tablets help keep me regular each day.,used year happy get delivered home feel tablet help keep regular day,5.0
These are great I started taking for fiber/digestion but noticed they where clearing up congestion in my chest caused by allergies and the immune system building part of these vitamins where clearing up my allergies.love these vitamins for many reasons,great started taking fiberdigestion noticed clearing congestion chest caused allergy immune system building part vitamin clearing allergieslove vitamin many reason,5.0
"This source of chewable fiber is my favorite. It tastes fruity and it is convenient - those two reasons alone keep me from NOT making the effort. I simply can't stand the orange drink fiber option - it has a gross texture and makes me feel bloated after drinking it. These are kind of a treat. Some reviewers don't care for these but dont strike me as chalky, or stick-to-teeth, or anything. This review was collected as part of a promotion.",source chewable fiber favorite taste fruity convenient two reason alone keep making effort simply cant stand orange drink fiber option gross texture make feel bloated drinking kind treat reviewer dont care dont strike chalky sticktoteeth anything review collected part promotion,5.0
this do a great job but I like the orange fiber Choice you no longer carry better,great job like orange fiber choice longer carry better,4.0
"It is fine, but it lacked the weight control feature that I was hoping for. My fault, I guess, but it's fine otherwise.",fine lacked weight control feature hoping fault guess fine otherwise,4.0
This Product works great. I have been taking it for years. Wish it would come without any food colors.,product work great taking year wish would come without food color,4.0
"Tasty little treats, gives fiber and fills the sweet tooth. No gassy side effects.",tasty little treat give fiber fill sweet tooth gassy side effect,5.0
Great product,great product,5.0
"These are good tasting, easy to chew and swallow, just take one and I am on my way, no mixing of powder or measuring. I like them a lot and they seem to help with me being regular.",good tasting easy chew swallow take one way mixing powder measuring like lot seem help regular,5.0
If you need some fiber to help you these are the ones to definitely get.,need fiber help one definitely get,5.0
It helps digestion.,help digestion,5.0
Took forever for Walmart to ship this item....,took forever walmart ship item,5.0
Love getting a great source of fiber in a delicious tablet!,love getting great source fiber delicious tablet,5.0
Great,great,5.0
"It was a good choice for me. It was delivered on time. I order AZO I ordered two, but only got one because the person who delivered it dropped it over the gate and my dogs got a hold of it. There is a note on the outside of gate asking the person who delivers packages to put it on the ledge. And for some reason the person didn't read the note.",good choice delivered time order azo ordered two got one person delivered dropped gate dog got hold note outside gate asking person delivers package put ledge reason person didnt read note,5.0
great way to increase fiber intake,great way increase fiber intake,5.0
"Best price around, quality product. Works as well as other brands- like the chewies... Got one of these for a friend as well as two for myself",best price around quality product work well brand like chewies got one friend well two,5.0
"This wine thief works exactly as advertised. Sanitize it, pump it up and down in the must or wine a few times and it fills right up. It will work with your hydrometer in it and it's also great for filling a sample cylinder. Really speeds of the process when checking specific gravity.",wine thief work exactly advertised sanitize pump must wine time fill right work hydrometer also great filling sample cylinder really speed process checking specific gravity,0.0
"Works great when the pin at the bottom sits correctly, which seems to be maybe half of the time. Otherwise it has a slow leak which makes pulling a sample difficult. However when it does sit correctly it works great and makes taking a gravity reading a breeze just sterilize the thief and hydrometer, and drop the hydrometer right into the thief. Pull a sample, take a reading, and return the beer into your fermenter by pressing the pin against the side of your vessel.",work great pin bottom sits correctly seems maybe half time otherwise slow leak make pulling sample difficult however sit correctly work great make taking gravity reading breeze sterilize thief hydrometer drop hydrometer right thief pull sample take reading return beer fermenter pressing pin side vessel,0.0
One of my best investments! Makes is so much easier to sample out of a glass carboy and not waste the sample! you can take a hydrometer reading right inside the tube then empty it back into the carboy or other fermenter.,one best investment make much easier sample glass carboy waste sample take hydrometer reading right inside tube empty back carboy fermenter,0.0
"This product works exactly as expected. Makes taking samples for hydrometer readings easier than ever. I just drop my hydrometer into the thief and get my reading with no other equipment needed.The only problem I have is sometimes it doesn't drain very well when I have lots of hop particles or other solids floating around in the wort, but this is more of just a small annoyance than any kind of defect in the product.",product work exactly expected make taking sample hydrometer reading easier ever drop hydrometer thief get reading equipment neededthe problem sometimes doesnt drain very well lot hop particle solid floating around wort small annoyance kind defect product,0.0
Good way to sample your Mead or Wine with out bothering the sediment on the bottom. Use to take gravity measurements or just grab a young not quite ready drink.,good way sample mead wine bothering sediment bottom use take gravity measurement grab young quite ready drink,0.0
a must if your making wine or brewing beer. dip it in and it will take it out. now you can take your reading. touch the tip and it will come right out.,must making wine brewing beer dip take take reading touch tip come right,0.0
"This works OK, but it does tend to drip out of the bottom when used. Besides using a refractometer, it would be nice if these wine thiefs and hydrometers were smaller in diameter so as to not waste so much beer when taking gravity samples.",work ok tend drip bottom used besides using refractometer would nice wine thief hydrometer smaller diameter waste much beer taking gravity sample,0.0
Great way to safely and easily remove some home brew from a 5 gallon batch to test it with a hydrometer. Gives you a good long reach into the carboy and it does a great job grabbing enough for testing purposes. Using mine with a 5 gallon glass carboy with a top that accommodates a size 7 stopper. Sanitize it beforehand to prevent contamination and if you're careful you can pour it back when you're done. Dripping is truly minimal. Might find a drop or two from point A to B. Not a necessity for every home brewer but for me it's come in handy.,great way safely easily remove home brew gallon batch test hydrometer give good long reach carboy great job grabbing enough testing purpose using mine gallon glass carboy top accommodates size stopper sanitize beforehand prevent contamination youre careful pour back youre done dripping truly minimal might find drop two point b necessity every home brewer come handy,0.0
"I would give this 3 stars since it does tend to leak out the bottom, but brewing is messy so it doesnt bother me. I am giving it 4 stars because mine came with the insert to use it as an autosiphon which was a huge plus. Not sure if this was as intended or a mistake. Either way, works for me!",would give star since tend leak bottom brewing messy doesnt bother giving star mine came insert use autosiphon huge plus sure intended mistake either way work,0.0
"This works OK, but it does tend to drip out of the bottom when used. Besides using a refractometer, it would be nice if these wine thiefs and hydrometers were smaller in diameter so as to not waste so much beer when taking gravity samples.",work ok tend drip bottom used besides using refractometer would nice wine thief hydrometer smaller diameter waste much beer taking gravity sample,0.0
a must if your making wine or brewing beer. dip it in and it will take it out. now you can take your reading. touch the tip and it will come right out.,must making wine brewing beer dip take take reading touch tip come right,0.0
"Works great when the pin at the bottom sits correctly, which seems to be maybe half of the time. Otherwise it has a slow leak which makes pulling a sample difficult. However when it does sit correctly it works great and makes taking a gravity reading a breeze just sterilize the thief and hydrometer, and drop the hydrometer right into the thief. Pull a sample, take a reading, and return the beer into your fermenter by pressing the pin against the side of your vessel.",work great pin bottom sits correctly seems maybe half time otherwise slow leak make pulling sample difficult however sit correctly work great make taking gravity reading breeze sterilize thief hydrometer drop hydrometer right thief pull sample take reading return beer fermenter pressing pin side vessel,0.0
"This wine thief works exactly as advertised. Sanitize it, pump it up and down in the must or wine a few times and it fills right up. It will work with your hydrometer in it and it's also great for filling a sample cylinder. Really speeds of the process when checking specific gravity.",wine thief work exactly advertised sanitize pump must wine time fill right work hydrometer also great filling sample cylinder really speed process checking specific gravity,0.0
Perfect size for dropping into the head of a carboy without it falling in. You always get just enough of a sample to test and can easily return it when done.,perfect size dropping head carboy without falling always get enough sample test easily return done,0.0
Excellent Choice. Have never seen Locally,excellent choice never seen locally,5.0
"This ginger cocktail is great for tea, a mixed beverage or straight over ice. It is very soothing for a sort throat.",ginger cocktail great tea mixed beverage straight ice very soothing sort throat,5.0
i bough my first few bottles in Vermont where this is made. Onlne purchasing makes it easy to acquire instead of driving 2 hours,bough first bottle vermont made onlne purchasing make easy acquire instead driving hour,5.0
Great to use as a substitute for ginger in your cocktail mixes. You don't get the same freshness you get from grated ginger but it does the job in a pinch.,great use substitute ginger cocktail mix dont get freshness get grated ginger job pinch,5.0
"and don't let the price sway your selection! We have served these wines from Super Bowl gatherings to most recently our Thanksgiving celebration. Everyone enjoyed the wines and when we asked what they thought they cost, they couldn't believe the value! Love the Belle Made For You wines!!",dont let price sway selection served wine super bowl gathering recently thanksgiving celebration everyone enjoyed wine asked thought cost couldnt believe value love belle made wine,5.0
Delio only problem they cooked unevenly,delio problem cooked unevenly,4.0
This is my favorite quickie,favorite quickie,5.0
great afternoon snack,great afternoon snack,5.0
"I love this stuff. I like Coco LoPez but it is in a can which makes it difficult to use just a couple of tablespoons. I add it to my fruit smoothies and gives them just that touch of sweetness and coconut flavoring to make them pop. Right now I am using it with an orange chicken stir fry. My problem is that I have been looking for it for about a month and cannot find it at the Walmart stores where I bought it originally. While this is a great product I really don't want to buy a case of it. However, if that is the only way I can get it I may have no other choice. Please start stocking this in the stores.",love stuff like coco lopez make difficult use couple tablespoon add fruit smoothy give touch sweetness coconut flavoring make pop right using orange chicken stir fry problem looking month find walmart store bought originally great product really dont want buy case however way get may choice please start stocking store,5.0
"I was searching for coconut syrup at my Walmart one day, and I found this Coco Real in the mixed drinks section. While I don't drink alcoholic drinks, I do enjoy mocktails occasionally, so I figured if it wouldn't work for pancakes, then I could make Pina/Colada Mocktails out of it and some pineapple juice. I shook the bottle good to make sure everything was mixed well, then used it on my hot pancakes at home. It was sooooo good. I usually only use pure maple syrup on them, but wanted some coconut syrup. This really filled that need so well. It was so delicious that I do believe I wouldn't even need to use butter on my pancakes when I use Coco Real as my syrup. It's not been easy to find locally for some reason, not even at the Walmart where I found it once. I bought the last two bottles Walmart had that day. It would be very nice if Walmart.com would make it available by the bottle without having to purchase an entire case at one time. I used one of those two bottles up pretty fast, but since I can't find it anymore, I am saving my remaining bottle for when I will get a real bad craving for coconut syrup. Torani also makes a good sugar-free coconut syrup that I would like for Walmart.com to keep in stock regularly, as well as their sugar-free Watermelon syrup. In the hot summertime, Torani sugar-free Watermelon syrup makes such refreshing drinks, and it goes well with Mexican food, which I really enjoy. It's the next best thing to liquefying cubes of real watermelon in my blender and chilled.",searching coconut syrup walmart one day found coco real mixed drink section dont drink alcoholic drink enjoy mocktails occasionally figured wouldnt work pancake could make pinacolada mocktails pineapple juice shook bottle good make sure everything mixed well used hot pancake home sooooo good usually use pure maple syrup wanted coconut syrup really filled need well delicious believe wouldnt even need use butter pancake use coco real syrup easy find locally reason even walmart found bought last two bottle walmart day would very nice walmartcom would make available bottle without purchase entire case one time used one two bottle pretty fast since cant find anymore saving remaining bottle get real bad craving coconut syrup torani also make good sugarfree coconut syrup would like walmartcom keep stock regularly well sugarfree watermelon syrup hot summertime torani sugarfree watermelon syrup make refreshing drink go well mexican food really enjoy next best thing liquefying cube real watermelon blender chilled,5.0
Until recently (Spring 2012)Mr MRS T's Original tasted like a tomato juice based scrumptous blody-mary mix. My wife and I enjoyed it. Now the original is made with high fructose cord syrup and no loger even tastes like it has a tomato juice base. I will no longer purchase this bastardized concoction.,recently spring mr mr t original tasted like tomato juice based scrumptous blodymary mix wife enjoyed original made high fructose cord syrup loger even taste like tomato juice base longer purchase bastardized concoction,0.0
"I actually like this alone, without any vodka! Tomato juice is good, but I love the spiciness of this mix even better. The cans make it portable (I carry them as a snack at work), and although I'm disappointed that Mr. Mrs. T has apparently discontinued the 11.5 oz size I used to buy, this size works for me, too.",actually like alone without vodka tomato juice good love spiciness mix even better can make portable carry snack work although im disappointed mr mr apparently discontinued oz size used buy size work,0.0
I keep these on hand for my aging mother in assisted living as she likes a little spice in her snacks. These taste very good and are small enough for a quick snack between meals. I also use them in soups and stews to enrich the broth. They even make a great quick cup of soup by themselves when microwaved and topped with some grated cheese. Very nice product.,keep hand aging mother assisted living like little spice snack taste very good small enough quick snack meal also use soup stew enrich broth even make great quick cup soup microwaved topped grated cheese very nice product,0.0
"I developed an appreciation for this drink during my days of frequent airline travel. I prefer to drink them straight (without booze). As a result, I started buying bottles of the mix at the grocery store--because finding this by the can in the real world is impossible. IMPOSSIBLE. Unfortunately, when you buy this by the bottle something happens. The first glass tastes exactly as you expected. But once you open the bottle, if you don't drink the contents within 24-36 hours the taste turns. Keeping a stock of cans in the house, therefore, is essential. I live in a major metropolitan area and I can't find these cans in any store. Not grocery stores (including mom pop, big chains, high-end small chains, etc), not liquor stores (including corner stores or BevMo). Enter Amazon. I'm very grateful I can buy this by the can here on the interwebs. I personally prefer the smaller-size cans to the 11.5 ounce. Make sure to buy enough to qualify for super saver shipping.",developed appreciation drink day frequent airline travel prefer drink straight without booze result started buying bottle mix grocery storebecause finding real world impossible impossible unfortunately buy bottle something happens first glass taste exactly expected open bottle dont drink content within hour taste turn keeping stock can house therefore essential live major metropolitan area cant find can store grocery store including mom pop big chain highend small chain etc liquor store including corner store bevmo enter amazon im very grateful buy interwebs personally prefer smallersize can ounce make sure buy enough qualify super saver shipping,0.0
"I think you can probably get this at most grocery stores. It really is one of the best mixes for bloody mary's. You hardly have to add anything extra to make a reasonable bloody mary. I usually add olives and pickle juice, though.",think probably get grocery store really one best mix bloody mary hardly add anything extra make reasonable bloody mary usually add olive pickle juice though,0.0
These beverages are good with or without Alcohol. They used to hand them out like candy on American Airlines. I saw them here on Amazon and I could not resist!,beverage good without alcohol used hand like candy american airline saw amazon could resist,0.0
"From the amount of this stuff I order, the folks at Amazon must think I'm a serious alcoholic. Truth is, I drink this because it's an extremely tasty Tomato Juice Cocktail! No alcohol necessary. Much tastier than V-8. Try it! You could even add alcohol, if it pleases you.",amount stuff order folk amazon must think im serious alcoholic truth drink extremely tasty tomato juice cocktail alcohol necessary much tastier v try could even add alcohol plea,0.0
