reviews.text,processed_text,reviews.rating
"The last time I bought buffalo wings, I bought a name brand. I was very disappointed with them as they had almost no heat at all.I bought the Great Value brand last time and I was apprehensive. But I could not believe how much flavor they had and how spicy they were. They were delicious!!",last time bought buffalo wing bought name brand very disappointed almost heat alli bought great value brand last time apprehensive could believe much flavor spicy delicious,0.0
Very tender and juice. Will buy again,very tender juice buy,0.0
I did not have the same experience as the other reviewer. What we got was just as advertised - chunks of white meat in breading. My kids love these.,experience reviewer got advertised chunk white meat breading kid love,0.0
The chicken did not have much flavor and tasted cheap.,chicken much flavor tasted cheap,0.0
"We opened the bag and see nice sized chunks of chicken. We were mistaken, we see maybe 3 or 4 pieces of good sized chunks but the rest were tiny and mostly breading.",opened bag see nice sized chunk chicken mistaken see maybe piece good sized chunk rest tiny mostly breading,0.0
"Game and some wings, life is good",game wing life good,0.0
They had chicken. They were breaded. They didn't even need a dipping sauce.,chicken breaded didnt even need dipping sauce,0.0
We go through a bag of these the first day I bring them home. They have the perfect amount of spicy. I do wish there were more in the bag,go bag first day bring home perfect amount spicy wish bag,0.0
My son and grandson love these wings!,son grandson love wing,0.0
there delicious,delicious,0.0
"They are good, just thought that it would be spicier.",good thought would spicier,0.0
The wings were nasty,wing nasty,0.0
My favorite,favorite,0.0
"favor is better, meat is tender even in microwave. .price is reasonable",favor better meat tender even microwave price reasonable,0.0
"I have to be honest for boneless chicken wyngz, these are definitely my favorite. I prefer them over the tyson brand. The only complaint I have is they are very hard to get in my local store. They are regularly out of them. That can be frustrating.",honest boneless chicken wyngz definitely favorite prefer tyson brand complaint very hard get local store regularly frustrating,0.0
Taste great,taste great,0.0
"quick, easy, and delicious",quick easy delicious,0.0
"These chicken ""wyngz"" were gross. Way too much breading, and the taste of buffalo sauce was barely noticeable. At the price Walmart sells these at, I can't recommend them on any level.",chicken wyngz gross way much breading taste buffalo sauce barely noticeable price walmart sell cant recommend level,0.0
Not all of the walmarts around me have them so I always go to the one that carries them even though it's further away!! Yum yum yum,walmarts around always go one carry even though away yum yum yum,0.0
"They barely have a hint of buffalo flavor. If you like your wings to taste of nothing but pepper than these are for you. They have plenty of flavor to them just not what your expecting for buffalo flavor. Now the wings themselves are not bad. They are decently meaty. Maybe a little to heavy on the breading, but not to bad though. The sizes of the wings vary greatly but not really a big deal. I'd by them again if they change the flavoring, but i'd say just stick to the plain and get your own sauce.",barely hint buffalo flavor like wing taste nothing pepper plenty flavor expecting buffalo flavor wing bad decently meaty maybe little heavy breading bad though size wing vary greatly really big deal id change flavoring id say stick plain get sauce,0.0
Hot and irregular cuts of chicken,hot irregular cut chicken,0.0
My son loves them. Great flavor and great price!,son love great flavor great price,0.0
We usually buy the Tyson Any'tizer boneless wings but bought these to save a little money. BIG MISTAKE! These wings have twice the sodium as the Tyson chicken and you can definitely tell by the taste. We ended up throwing the whole bag away. Next time we'll spend the extra dollar.,usually buy tyson anytizer boneless wing bought save little money big mistake wing twice sodium tyson chicken definitely tell taste ended throwing whole bag away next time well spend extra dollar,0.0
"These Great Value Buffalo Style Boneless Wyngz are extremely hot. If you like spicy, hot, flavors in your food then these are for you. I thought they cooked up well, but I just did not care for the spicy hotness of them.",great value buffalo style boneless wyngz extremely hot like spicy hot flavor food thought cooked well care spicy hotness,0.0
Great price too!,great price,0.0
These pack some heay. Good but spicy!,pack heay good spicy,0.0
Tried these on a whim & found much better than the usual name brand I buy.,tried whim found much better usual name brand buy,0.0
"TASTES GREAT ! ! ! EXTREMELY HARD TO BEAT THE PRICE, BUT IT SEEMS TO BE VERY HARD TO FIND - IN STOCK - ONE OF THE MANAGERS TOLD ME THAT A LARGE DISPLAY OF IT JUST SAT ALL SUMMER - I PERSONALLY DON'T UNDERSTAND IT - EVER SINCE I FOUND IT - I GO OUT OF MY WAY TO BUY IT. I PERSONALLY LIKE IT MORE THAN SOME OF THE MORE EXPENSIVE BEERS ! ! !",taste great extremely hard beat price seems very hard find stock one manager told large display sat summer personally dont understand ever since found go way buy personally like expensive beer,5.0
For the price you can't beat this beer.Mild good taste.Enjoy.,price cant beat beermild good tasteenjoy,4.0
Perfect sipping tequila ... chilled and neat !,perfect sipping tequila chilled neat,5.0
"My buddy ordered some shots of this stuff during a horns game. Frankly when it comes to tequila, I usually brace myself for a rough shot. Maybe I'm drinking the wrong stuff, because this was really easy to put back. No lingering aftertaste. Reasonably priced. Good value tequila if you're looking.",buddy ordered shot stuff horn game frankly come tequila usually brace rough shot maybe im drinking wrong stuff really easy put back lingering aftertaste reasonably priced good value tequila youre looking,5.0
Straight over ice.,straight ice,5.0
"excellent cucumber taste, makes the perfect summer cocktails!",excellent cucumber taste make perfect summer cocktail,5.0
expensive,expensive,5.0
"This really is the best root beer I have ever tasted! I usually buy it in our grocery store (about 4.50 per four pack), but it's sold out a lot! The ingredients are clean and natural, while most of the other root beers have junk ingredients, caramel color. I quit drinking traditional sodas years ago, because of the nasty ingredients and taste. Virgil's is absolute heaven in a root beer float. Virgil's root beer is micro brewed, smooth and creamy and I am addicted to it, I think. It's worth every penny.Description and ingredients:Virgils is a superb blend of spices and herbs gathered from the world over anise, licorice, vanilla (bourbon), cinnamon, clove, wintergreen, sweet birch, molasses, nutmeg, pimento berry oil, balsam oil and cassia oil.Ingredients: Purified carbonated water, unbleached cane sugar, caramelized unrefined cane sugar, citric acid, herbs and spices! Gluten Free. No Preservatives, No Caffeine, No GMOs, and No artificial anything!",really best root beer ever tasted usually buy grocery store per four pack sold lot ingredient clean natural root beer junk ingredient caramel color quit drinking traditional soda year ago nasty ingredient taste virgil absolute heaven root beer float virgil root beer micro brewed smooth creamy addicted think worth every pennydescription ingredientsvirgils superb blend spice herb gathered world anise licorice vanilla bourbon cinnamon clove wintergreen sweet birch molasses nutmeg pimento berry oil balsam oil cassia oilingredients purified carbonated water unbleached cane sugar caramelized unrefined cane sugar citric acid herb spice gluten free preservative caffeine gmos artificial anything,5.0
"Virgils Natural Micro Brewed Rootbeer Soda, 12 Ounce -- 24 per case, from Virgils Rootbeer.I have mixed feelings about Virgil's Rootbeer. To start with, the root and bark of the Sassafras tree are no longer used, as they cause cancer and liver damage. The Sarsaparilla vine used to be used, but nowadays, most root beers use an artificial sarsaparilla flavor. Virgil's is naturally brewed from Sweet Birch, and a lot of other natural flavors. The licorice does not improve it, it contains too much sugar, and it is packaged in a breakable glass bottle. Processed food makers in general use far too much sugar and salt than is good for us. Virgil's RootBeer is natural and definitely different, but as a root beer, I can only give it three and a half Amazon stars, rounded off to four stars, as Amazon requires ratings to be in whole numbers.The Nutrition Facts, and Ingredients, as listed on the bottle:Nutrition Facts:Serving size: 12 oz. (355mL).Amount Per Serving:Calories 160.Total Fat 0g.Sodium 0g.Total Carbohydrate 42g (Sugars 42g).Protein 0g.Ingredients:Purified carbonated water, unbleached cane sugar, caramelized unrefined cane sugar, herbs, spices and citric acid.Also listed ingredients: Anise, Licorice, Vanilla (Bourbon), Cinnamon, Clove, Wintergreen, Sweet Birch, Molasses, Nutmeg, Pimento Berry Oil, Balsam Oil and Oil of Cassia.CONTAINS NO PRESERVATIVES OR CAFFEINE. ALL NATURAL. GLUTEN FREE.Sold by Please and Thank You LLC.Made by REED'S Inc., 13000 South Spring Street, LA, CA 90061 phone: 1.800.99.REEDS (1.800.997.3337) NYSE: REED web: Virgils.com single container UPC Code: 0 90341 12121 2 Made in CA, USA.",virgil natural micro brewed rootbeer soda ounce per case virgil rootbeeri mixed feeling virgil rootbeer start root bark sassafras tree longer used cause cancer liver damage sarsaparilla vine used used nowadays root beer use artificial sarsaparilla flavor virgil naturally brewed sweet birch lot natural flavor licorice improve contains much sugar packaged breakable glass bottle processed food maker general use far much sugar salt good u virgil rootbeer natural definitely different root beer give three half amazon star rounded four star amazon requires rating whole numbersthe nutrition fact ingredient listed bottlenutrition factsserving size oz mlamount per servingcalories total fat gsodium gtotal carbohydrate g sugar gprotein gingredientspurified carbonated water unbleached cane sugar caramelized unrefined cane sugar herb spice citric acidalso listed ingredient anise licorice vanilla bourbon cinnamon clove wintergreen sweet birch molasses nutmeg pimento berry oil balsam oil oil cassiacontains preservative caffeine natural gluten freesold please thank llcmade reed inc south spring street la ca phone reed nyse reed web virgilscom single container upc code made ca usa,4.0
Found this in a health food store and my son and I LOVED it! It is THE BEST tasting and healthy root beer ever! I am giving this as gifts to friends and family.,found health food store son loved best tasting healthy root beer ever giving gift friend family,5.0
"I only stumbled upon this after reading it's apparently created by Walmart, it's a private label brand from what I read, not sure how true that is, but the taste was good all throughout, but I still have 2 or 3 left in the case to try, at a little less than a dollar per can, the price can't be beat, if you want to try something different lol....",stumbled upon reading apparently created walmart private label brand read sure true taste good throughout still left case try little le dollar per price cant beat want try something different lol,5.0
need salt or a lime but the addition of it makes it even better...,need salt lime addition make even better,5.0
drink,drink,5.0
Very good flavor without a over powering finish.. Never need salt or a lime but the addition of it makes it even better...one of my favorite silver tequilas,very good flavor without powering finish never need salt lime addition make even betterone favorite silver tequila,5.0
Use for shots.,use shot,5.0
This is hands down my favorite tequila. Amazing taste at an amazing price. No lime salt needed.,hand favorite tequila amazing taste amazing price lime salt needed,5.0
"I absolutely love this wine. With Moscato D'Asti being my favorite, I have tried several brands. Stella Rosa is my absolute favorite. I won't try any others. It's crisp and sweet with no icky aftertaste. I love it!",absolutely love wine moscato dasti favorite tried several brand stella rosa absolute favorite wont try others crisp sweet icky aftertaste love,5.0
Very good sweet moscato,very good sweet moscato,5.0
tasted great twist OFF cap may easy to me If you put it down so it was knock down It Would Not Spill Out If You Have cap On Good a Very Good Idea Very Good Buy I Understood Some Towards Contributions Go Towards Veterans,tasted great twist cap may easy put knock would spill cap good very good idea very good buy understood towards contribution go towards veteran,5.0
,,5.0
"For those of you who want to enjoy a nice beverage that is not as sweet, try this mix. My husband has been purchasing this for some time now. Added to that, we pay the 50 yearly one time purchase to have future items from Walmart shipped to your home free. So worth the cost.",want enjoy nice beverage sweet try mix husband purchasing time added pay yearly one time purchase future item walmart shipped home free worth cost,5.0
This product seems to help my liver if I take it before eating.,product seems help liver take eating,3.0
"Very happy to get more bitters in my diet, and they are organic!",very happy get bitter diet organic,5.0
this didn't taste like olive juice from an actual jar of olives. it tasted a bit sweeter or like it was synthetic. i wouldn't recommend.,didnt taste like olive juice actual jar olive tasted bit sweeter like synthetic wouldnt recommend,2.0
"I really like this product - it's the best out there. However, the combination of the occasional bad (mold) bottle, and the glass breakage/leaking, for the price point it's not worth the hassle. If I can buy it locally I will, otherwise I have to give up on Dirty Sue :-(",really like product best however combination occasional bad mold bottle glass breakageleaking price point worth hassle buy locally otherwise give dirty sue,3.0
Way better then using juice from the olives. Best martinis i have made yet.,way better using juice olive best martini made yet,5.0
Great addition to my martini Monday . . .,great addition martini monday,4.0
Absolutely perfect. Will reorder often.,absolutely perfect reorder often,5.0
Really good stuff!!,really good stuff,5.0
"Hubby says it's ok, but he prefers the olive juice in a jar of olives.",hubby say ok prefers olive juice jar olive,4.0
Great for bloody mary's!,great bloody mary,5.0
great stuff!,great stuff,5.0
Very satisfied,very satisfied,4.0
I cant even drink a dirty martini anymore if I dont have Dirty Sue. I use a shot of it in Bloody Mary's too. There is no comparison to the juice found in olive jars... this stuff is like the top-shelf of olive brine. I highly recommend it!,cant even drink dirty martini anymore dont dirty sue use shot bloody mary comparison juice found olive jar stuff like topshelf olive brine highly recommend,0.0
"I like martinis about as dirty as they can come. This stuff is just the bomb! It's so much more flavorful than any olive juice I've tasted from olives in a jar. It's full bodied, not just briny.Go ahead.... you're DEFINITELY worth it.!",like martini dirty come stuff bomb much flavorful olive juice ive tasted olive jar full bodied brinygo ahead youre definitely worth,0.0
This is just what I have been looking for..as a lover of a good strong dirty martini I am known for having a refer full of juiceless olive jars. Dirty Sue was truly a find. I keep plenty of it stocked enough to share with my fiends and even those mere acquaintances that stop by.,looking foras lover good strong dirty martini known refer full juiceless olive jar dirty sue truly find keep plenty stocked enough share fiend even mere acquaintance stop,0.0
"Delicious. I recently went through a dirty martini phase and was frustrated with the inconsistent quality of my drinks. Some were fabulous while others tasted outright disgusting. A waste of precious quality vodka. I quickly figured out that for me, only salt brines will do. No vinegar.I was discarding a lot of expensive olives for the sake of a few drinks and thought surely there must be a source for brine only. I read reviews and ingredient lists until finding Dirty Sue. This product ain't cheap (it's salt water after all) but I was not disappointed. Like I said before, NO VINEGAR. I'm very pleased. Will be purchasing several bottles for Christmas and pairing them with a nice Vodka as gifts.",delicious recently went dirty martini phase frustrated inconsistent quality drink fabulous others tasted outright disgusting waste precious quality vodka quickly figured salt brine vinegari discarding lot expensive olive sake drink thought surely must source brine read review ingredient list finding dirty sue product aint cheap salt water disappointed like said vinegar im very pleased purchasing several bottle christmas pairing nice vodka gift,0.0
"If you want to make a good dirty martini, this is the stuff that is going to help you. It is the only Olive Juice my husband will take in his martinis and really the only one we ever have on hand always. Because we do entertain a lot, this gets bought often and is enjoyed by all.",want make good dirty martini stuff going help olive juice husband take martini really one ever hand always entertain lot get bought often enjoyed,0.0
I have been a dirty martini drinker for years and I've never been able to find a good olive juice. Other brands claim to be 100 olive juice and they are really just glorified salt water. Dirty Sue is pure olive juice in a bottle. Or should I say pure magic in a bottle. I have a bottle of Dirty Sue in my fridge and a bottle of Ketel One in my freezer and I am a happy man.,dirty martini drinker year ive never able find good olive juice brand claim olive juice really glorified salt water dirty sue pure olive juice bottle say pure magic bottle bottle dirty sue fridge bottle ketel one freezer happy man,0.0
"If you like dirty martini's, this is the only way to go! The tasteis outta this world and it's a superior juice than the stuff thatcomes in olive jars to preserve the olives. Ask for it at your local bar!!",like dirty martini way go tasteis outta world superior juice stuff thatcomes olive jar preserve olive ask local bar,0.0
"This product is great! I am a general manager at an upscale restaurant in Hollywood, CA and I was tired of having my bartenders taking the time to drain the brine out of jars of olives. It's a huge waste of time, and the olives when separated from the brine dry out almost immediately. Once I discovered Dirty Sue, not only did it fix these problems, but it allows me to offer my guests a much higher quality of olive juice. Let's face it, if a patron is going to order a high end gin or vodka martini, why would they want a sub par ingredient mixed with it",product great general manager upscale restaurant hollywood ca tired bartender taking time drain brine jar olive huge waste time olive separated brine dry almost immediately discovered dirty sue fix problem allows offer guest much higher quality olive juice let face patron going order high end gin vodka martini would want sub par ingredient mixed,0.0
It's a little too dirty but we used the whole bottle in a couple of weeks.,little dirty used whole bottle couple week,3.0
"Very tasty. Just the mix I was looking for, good quality.",very tasty mix looking good quality,5.0
"We have used other martini mixes, but this one is definitely the best. With a good vodka, the drinks are so smooth not bitter.",used martini mix one definitely best good vodka drink smooth bitter,5.0
"Very, Very Good",very very good,5.0
Love this for my dirty martinis. The taste is very good.,love dirty martini taste very good,5.0
Great addition to dirty martinis,great addition dirty martini,5.0
Above and beyond!,beyond,5.0
Super good!!!,super good,5.0
"I like martinis about as dirty as they can come. This stuff is just the bomb! It's so much more flavorful than any olive juice I've tasted from olives in a jar. It's full bodied, not just briny.Go ahead.... you're DEFINITELY worth it.!",like martini dirty come stuff bomb much flavorful olive juice ive tasted olive jar full bodied brinygo ahead youre definitely worth,5.0
Have always loved Dirty Sue. Arrives on time and works great in martini's.,always loved dirty sue arrives time work great martini,5.0
it was everything I thought it would be and I would buy it again,everything thought would would buy,5.0
So Far Dirty Sue Martini Mix is the BEST we have ever used!!! :-),far dirty sue martini mix best ever used,5.0
Dirty Sue is the best mix for dirty martini's that I have found!,dirty sue best mix dirty martini found,5.0
A staple that we now can't live without...makes the best dirty 'Tini's!,staple cant live withoutmakes best dirty tinis,5.0
My go to for Dirty Martini's and it should be yours..,go dirty martini,5.0
Good dirty mix. A bit expensive so gave it 4 stars.,good dirty mix bit expensive gave star,4.0
Just the right mix to make my dirty martinis dirty!,right mix make dirty martini dirty,5.0
I have tried every si gle kind of olive juice and have been extremely disappointed in all (even threw them out) in every case but Dirty Sue. This just can't be beat.,tried every si gle kind olive juice extremely disappointed even threw every case dirty sue cant beat,5.0
GREAT.... TOO BAD IT ISN'T AVAILABLE LOCALLY..........,great bad isnt available locally,5.0
This is the stuff. Delicious. I wanted to drink the bottle without the martini! I would definitely order thus again.,stuff delicious wanted drink bottle without martini would definitely order thus,5.0
"Delicious. I recently went through a dirty martini phase and was frustrated with the inconsistent quality of my drinks. Some were fabulous while others tasted outright disgusting. A waste of precious quality vodka. I quickly figured out that for me, only salt brines will do. No vinegar.I was discarding a lot of expensive olives for the sake of a few drinks and thought surely there must be a source for brine only. I read reviews and ingredient lists until finding Dirty Sue. This product ain't cheap (it's salt water after all) but I was not disappointed. Like I said before, NO VINEGAR. I'm very pleased. Will be purchasing several bottles for Christmas and pairing them with a nice Vodka as gifts.",delicious recently went dirty martini phase frustrated inconsistent quality drink fabulous others tasted outright disgusting waste precious quality vodka quickly figured salt brine vinegari discarding lot expensive olive sake drink thought surely must source brine read review ingredient list finding dirty sue product aint cheap salt water disappointed like said vinegar im very pleased purchasing several bottle christmas pairing nice vodka gift,5.0
"Love it, but getting a little pricey. Order 1 18 oz instead of a 4 pack of 12 oz. May be making slightly less dirty martinis.",love getting little pricey order oz instead pack oz may making slightly le dirty martini,5.0
Dirty Sue. The perfect companion for the perfect Martini. Will never cheat on her. Highly recommend you give her a try. There's enough love to go around. .,dirty sue perfect companion perfect martini never cheat highly recommend give try there enough love go around,4.0
"If you want to make a good dirty martini, this is the stuff that is going to help you. It is the only Olive Juice my husband will take in his martinis and really the only one we ever have on hand always. Because we do entertain a lot, this gets bought often and is enjoyed by all.",want make good dirty martini stuff going help olive juice husband take martini really one ever hand always entertain lot get bought often enjoyed,5.0
It makes the biggest difference. I tried to use brine as a substitute - horrible taste. It's the real deal. A true mixer. Can't mix another Dirty Martini without it.,make biggest difference tried use brine substitute horrible taste real deal true mixer cant mix another dirty martini without,5.0
"Good stuff, one of the two best (the other being Olive Squeezins from FL) you can find on the market.",good stuff one two best olive squeezins fl find market,4.0
"This product is great! I am a general manager at an upscale restaurant in Hollywood, CA and I was tired of having my bartenders taking the time to drain the brine out of jars of olives. It's a huge waste of time, and the olives when separated from the brine dry out almost immediately. Once I discovered Dirty Sue, not only did it fix these problems, but it allows me to offer my guests a much higher quality of olive juice. Let's face it, if a patron is going to order a high end gin or vodka martini, why would they want a sub par ingredient mixed with it",product great general manager upscale restaurant hollywood ca tired bartender taking time drain brine jar olive huge waste time olive separated brine dry almost immediately discovered dirty sue fix problem allows offer guest much higher quality olive juice let face patron going order high end gin vodka martini would want sub par ingredient mixed,5.0
I cant even drink a dirty martini anymore if I dont have Dirty Sue. I use a shot of it in Bloody Mary's too. There is no comparison to the juice found in olive jars... this stuff is like the top-shelf of olive brine. I highly recommend it!,cant even drink dirty martini anymore dont dirty sue use shot bloody mary comparison juice found olive jar stuff like topshelf olive brine highly recommend,5.0
